Topic,Difficulty,Content
Emergency Funds,Beginner,"An emergency fund is a bank account with money set aside to pay for large, unexpected expenses. Rule of thumb: save 3-6 months of expenses."
The 50/30/20 Rule,Beginner,"A simple budgeting framework: 50% for Needs, 30% for Wants, and 20% for Savings/Debt reduction."
Compound Interest,Intermediate,Compound interest is the interest on savings calculated on both the initial principal and the accumulated interest from previous periods.
ETFs vs Mutual Funds,Advanced,ETFs trade like stocks on an exchange and typically have lower fees. Mutual funds are bought at the end of the trading day and may be actively managed.
Debt Snowball vs Avalanche,Intermediate,Snowball: pay off smallest debts first for psychological wins. Avalanche: pay off highest interest rate debts first to save money mathematically.
